MESSAGE_CODE,MESSAGE_CLASS,MESSAGE_TEXT
24304,External-Active-Directory,Communication with global catalog failed
24305,External-Active-Directory,Failover threshold has been exceeded
24306,External-Active-Directory,No DNS server available
24307,External-Active-Directory,DNS server returned error
24308,External-Active-Directory,None of required domains is joined
24309,External-Active-Directory,Identity name with no domain markup has been rejected by join points
24310,External-Active-Directory,User Principal Name (UPN) format recognized
24311,External-Active-Directory,Down-Level Logon (NetBIOS) Name format recognized
24312,External-Active-Directory,SAM Account Name format recognized
24313,External-Active-Directory,Search for matching accounts at join point
24314,External-Active-Directory,No matching account found in domain
24315,External-Active-Directory,Single matching account found in domain
24316,External-Active-Directory,Multiple matching accounts found in domain
24317,External-Active-Directory,LDAP search in domain failed
24318,External-Active-Directory,No matching account found in forest
24319,External-Active-Directory,Single matching account found in forest
24320,External-Active-Directory,Multiple matching accounts in forest
24321,External-Active-Directory,LDAP search in forest failed
24322,External-Active-Directory,Identity resolution detected no matching account
24323,External-Active-Directory,Identity resolution detected single matching account
24325,External-Active-Directory,Resolving identity
24326,External-Active-Directory,Searching subject object by UPN
24327,External-Active-Directory,Subject object found in a cache
24328,External-Active-Directory,Subject object not found in a cache
24329,External-Active-Directory,Subject cache entry expired
24330,External-Active-Directory,Lookup SID By Name request succeeded
24331,External-Active-Directory,Lookup SID By Name request failed
24332,External-Active-Directory,Lookup Object By SID request succeeded
24333,External-Active-Directory,Lookup Object By SID request failed
24336,External-Active-Directory,Subject object cached
24337,External-Active-Directory,Authentication Ticket (TGT) request succeeded
24338,External-Active-Directory,Authentication Ticket (TGT) request failed
24339,External-Active-Directory,Service Ticket request succeeded
24340,External-Active-Directory,Service Ticket request failed
24341,External-Active-Directory,Service Ticket validation succeeded
24342,External-Active-Directory,Service Ticket validation failed
24343,External-Active-Directory,RPC Logon request succeeded
24344,External-Active-Directory,RPC Logon request failed
24345,External-Active-Directory,RPC Change Password request succeeded
24346,External-Active-Directory,RPC Change Password request failed
24347,External-Active-Directory,Account disabled
24348,External-Active-Directory,Account locked
24349,External-Active-Directory,Account expired
24350,External-Active-Directory,Password expired
24351,External-Active-Directory,Account validation succeeded
24352,External-Active-Directory,Identity resolution failed
24353,External-Active-Directory,Resolving identity
24354,External-Active-Directory,LDAP fetch found no matching account in domain
24355,External-Active-Directory,LDAP fetch succeeded
24356,External-Active-Directory,LDAP fetch failed
24357,External-Active-Directory,Incoming identity was rewritten
24358,External-Active-Directory,Match was not found for any existing identity rewrite rule
24359,External-Active-Directory,Incoming identity was not rewritten
24360,External-Active-Directory,"[Diagnostic step] : Identity was found"
24361,External-Active-Directory,Machine authentication is disabled for some of the configured join points
24362,Authentication,Client certificate matches AD account certificate
24363,Authentication,Client certificate does not match AD account certificate
24364,Authentication,Resolve certificate identity ambiguity using certificates match
24365,Authentication,Resolve identity ambiguity using password verification
24366,External-Active-Directory,Skipping unjoined domain
24367,External-Active-Directory,Skipping unusable domain
24368,External-Active-Directory,Skipping unavailable domain
24369,External-Active-Directory,Skipping unavailable forest
24370,External-Active-Directory,User credentials have been revoked.
24371,External-Active-Directory,The ISE machine account does not have the required privileges to fetch groups.
24496,External-Active-Directory,Authentication rejected due to a white or black list restriction
24497,External-Active-Directory,Selected Active Directory Scope is empty
24498,External-Active-Directory,Resolve identity exceeded time limit
24631,Local-user-DB,Looking up User in Internal Guests IDStore
24632,Local-user-DB,Found User in Internal Guests IDStore
24633,Local-user-DB,The user is not found in the internal guests identity store
24700,External-Active-Directory,Identity resolution by certificate succeeded
24701,External-Active-Directory,Identity resolution by certificate failed
24702,External-Active-Directory,Identity resolution by certificate found no matching account
24703,External-Active-Directory,Identity resolution by certificate found ambiguous accounts
24704,External-Active-Directory,Authentication failed because identity credentials are ambiguous
24705,External-Active-Directory,Authentication failed because ISE server is not joined to required domains
24706,External-Active-Directory,Authentication failed because NTLM was blocked
24707,External-Active-Directory,Authentication failed because all identity names have been rejected
24708,External-Active-Directory,User not found in Active Directory. Some authentication domains were not available
24709,External-Active-Directory,Host not found in Active Directory. Some authentication domains were not available
24710,External-Active-Directory,Identity resolution is configured to drop request if required domain is not available
24711,External-Active-Directory,Domain controller cannot pass request through the trust path to the account domain
24712,External-Active-Directory,Authentication failed because domain trust is restricted
24800,System-Management,SAML Portal metadata was exported
24801,External-SAML-IdP,Unable to decode SAML request
24802,External-SAML-IdP,Unknown SAML attribute value type assertion used for 'username'
24803,External-SAML-IdP,Unable to find 'username' attribute assertion
24804,External-SAML-IdP,SAML message intended destination (required by binding) was not present
24805,External-SAML-IdP,SAML message intended destination endpoint did not match recipient endpoint
24806,External-SAML-IdP,SAML IdentityProvider Certificate is not valid
24807,External-SAML-IdP,SAML IdentityProvider Certificate was not checked
24808,External-SAML-IdP,SAML IdentityProvider Certificate is expired
24809,External-SAML-IdP,SAML IdentityProvider Certificate is revoked
24810,External-SAML-IdP,SAML IdentityProvider CA Certificate is not valid
24811,External-SAML-IdP,The request could not be performed due to an error on the part of the requester
24812,External-SAML-IdP,The request could not be performed due to an error on the part of the SAML responder or SAML authority
24813,External-SAML-IdP,The SAML responder could not process the request because the version of the request message was incorrect
24814,External-SAML-IdP,The responding provider was unable to successfully authenticate the principal
24815,External-SAML-IdP,Unexpected or invalid content was encountered within a saml:Attribute or saml:AttributeValue element
24816,External-SAML-IdP,The SAML responder or SAML authority is able to process the request but has chosen not to respond.
24817,External-SAML-IdP,The SAML responder or SAML authority does not support the request
24818,External-SAML-IdP,The SAML responder cannot properly fulfil the request using the protocol binding specified in the request
24819,External-SAML-IdP,Failed to retrieve signing certificate from the SAML response
24820,External-SAML-IdP,Assertion does not contain Issuer
24821,External-SAML-IdP,Assertion does not contain authentication statement
24822,External-SAML-IdP,Assertion does not contain audience restriction conditions
24823,External-SAML-IdP,Assertion does not contain matching service provider identifier in the audience restriction conditions
24824,External-SAML-IdP,Subject confirmation does not contain subject confirmation data
24825,External-SAML-IdP,The response must contain single assertion
24826,External-SAML-IdP,Recipient does not match assertion consumption URL
24827,External-SAML-IdP,Subject confirmation data does not contain NotOnOrAfter
24828,External-SAML-IdP,Assertion is expired
24829,External-SAML-IdP,Subject confirmation data IP address does not match end user IP address
24830,External-SAML-IdP,Subject confirmation data does not contain InResponseTo
24831,External-SAML-IdP,The InResponseTo does not match the original request id
24832,External-SAML-IdP,Issuer format is not equal to urn:oasis:names:tc:SAML:2.0:nameid-format:entity
24833,External-SAML-IdP,Issuer does not match Identity Provider ID
24834,External-SAML-IdP,Assertion does not contain subject
24835,External-SAML-IdP,Assertion does not contain subject confirmation
24836,External-SAML-IdP,Assertion does not contain bearer subject confirmation
24837,External-SAML-IdP,The signed response does not contain a Destination
24838,External-SAML-IdP,The Destination on the response does not match the assertion consumer URL
24839,External-SAML-IdP,The response does not contain assertion
24840,External-SAML-IdP,The response signature is invalid
24841,External-SAML-IdP,Response signature did not validate against the IdP signature certificate
24842,External-SAML-IdP,The assertion signature on the response is invalid
24843,External-SAML-IdP,Assertion signature is not not validated against the IdP signature certificate
24844,External-SAML-IdP,Neither SAML response nor assertion are signed
24845,External-SAML-IdP,SAML response can contain only one signing certificate
24846,External-SAML-IdP,Several certificates are configured on IdP
24847,External-SAML-IdP,Certificate is invalid
24848,External-SAML-IdP,Failed to get signing certificate from IdP configuration
25000,AD-Connector,ISE server password update succeeded
25001,AD-Connector,AD: ISE account password update failed.
25002,AD-Connector,ISE server TGT refresh succeeded
25003,AD-Connector,AD: Machine TGT refresh failed.
25004,AD-Connector,AD Connector started
25005,AD-Connector,AD Connector stopped
25006,AD-Connector,AD Connector had to be restarted.
25007,AD-Connector,Join point connector started
25008,AD-Connector,Join point connector stopped
25009,AD-Connector,Trusted domains discovery succeeded
25010,AD-Connector,Trusted domains discovery failed
25011,AD-Connector,Domain join succeeded
25012,AD-Connector,Domain join failed
25013,AD-Connector,Domain leave succeeded
25014,AD-Connector,Domain leave failed
25015,AD-Connector,DNS SRV query succeeded
25016,AD-Connector,DNS SRV query failed
25017,AD-Connector,DC discovery succeeded
25018,AD-Connector,DC discovery failed
25019,AD-Connector,KDC discovery succeeded
25020,AD-Connector,KDC discovery failed
25021,AD-Connector,GC discovery succeeded
25022,AD-Connector,GC discovery failed
25023,AD-Connector,LDAP connect to domain controller succeeded
25024,AD-Connector,LDAP connect to domain controller failed
25025,AD-Connector,LDAP connect to global catalog succeeded
25026,AD-Connector,LDAP connect to global catalog failed
25027,AD-Connector,RPC connect to domain controller succeeded
25028,AD-Connector,RPC connect to domain controller failed
25029,AD-Connector,KDC connect to domain controller succeeded
25030,AD-Connector,KDC connect to domain controller failed
25031,AD-Connector,AD Provider failed to start
25032,AD-Connector,Trusted domain discovered
25033,AD-Connector,DNS A/AAAA query succeeded
25034,AD-Connector,DNS A/AAAA query failed
25035,AD-Connector,Writeable DC discovery succeeded
25036,AD-Connector,Writeable DC discovery failed
25037,AD-Connector,DC record cached
25038,AD-Connector,GC record cached
25039,AD-Connector,LDAP SASL bind failed
25040,AD-Connector,RPC secure channel establishment failed
25041,AD-Connector,ISE Server site discovered
25042,AD-Connector,ISE Server is not assigned to any AD site
25043,AD-Connector,No domain controller found in ISE Server site
25044,AD-Connector,Communication to domain failed
25045,AD-Connector,Configured nameserver is down
25046,AD-Connector,Joined domain is unavailable
25047,AD-Connector,Authentication domain is unavailable
25048,AD-Connector,Active-Directory forest is unavailable
25049,AD-Connector,Machine account was not found
25050,AD-Connector,Machine account was deleted from AD
25051,AD-Connector,Machine account deletion was failed
25052,AD-Connector,Periodic trusts discovery started
25053,AD-Connector,Detected offline forest
25054,AD-Connector,Trust removed by discovery
25055,AD-Connector,DC added to black list
25056,AD-Connector,DC removed from black list
25057,AD-Connector,The ISE machine account does not have the required privileges to fetch groups.
34123,System-Management,The virtual memory usage is high indicating the process may be running out of memory resources
34124,System-Management,Due to low memory resources the amount of concurrent EAP sessions will be limited
34125,System-Management,Due to low memory resources a CRL could not be updated.
34126,System-Management,Remote syslog target is unavailable
34127,System-Management,Remote syslog target connection resume
34128,System-Management,Remote syslog target buffer is cleared
34129,System-Management,Could not initialize syslog client certificate
34130,System-Management,CTL for syslog server certificate is empty
34131,System-Management,Could not initialize the complete syslog client certificate chain
34132,System-Management,TLS handshake with syslog server succeeded
34133,System-Management,TLS handshake with syslog server failed
34134,System-Management,Could not initialize CTL for syslog server certificate verification
34135,System-Management,Started to drop syslog messages
34136,System-Management,Stopped dropping syslog messages
34137,System-Management,Secure syslog server rejected ISE syslog client certificate
34138,System-Management,ISE failed secure syslog connection because of unsupported certificate in syslog server certificate chain
34139,System-Management,ISE failed secure syslog connection because it was unable to download CRL for the CA that signed syslog server certificate
34140,System-Management,ISE failed secure syslog connection because of unknown certificate in syslog server certificate chain
34141,System-Management,ISE failed secure syslog connection because of expired certificate in syslog server certificate chain
34142,System-Management,ISE failed secure syslog connection because of expired CRL for the CA that signed syslog server certificate
34143,System-Management,ISE failed secure syslog connection because of revoked certificate in syslog server certificate chain
34144,System-Management,ISE failed secure syslog connection because of bad certificate in syslog server certificate chain
34145,System-Management,Secure syslog connection reconnect due to OCSP found revoked certificate
34146,System-Management,Secure syslog connection reconnect due to CRL found revoked certificate
34147,System-Management,JGroups TLS Handshake Failed
34148,System-Management,JGroups TLS Handshake Succeeded
34149,System-Management,HTTPS TLS Handshake Failed
34150,System-Management,HTTPS TLS Handshake Succeeded
34151,System-Management,Certificate Validation Failed
34152,System-Management,Certificate Validation Succeeded
34153,System-Management,Secure LDAP ID Store Connection Failed
34154,System-Management,Secure LDAP ID Store Connection Succeeded
34155,REST,Endpoint with the same Mac Address already exists
34156,System-Management,CARS Network configuration has been reset
34157,EAP,Could not initialize EAP-TTLS
34158,EAP,Could not initialize EAP-TTLS server-certificate
59259,Replication,Replication failed
60065,Administrator-Login,The maximum number of Administrative sessions have been exceeded
60066,Administrator-Login,The delta between the old and the new is not matched
60067,FeedService,Profiler Feed Service - automatic download initiated
60068,FeedService,Profiler Feed Service - manual download initiated
60069,FeedService,Profiler Feed Service - Profiles Downloaded
60070,FeedService,Profiler Feed Service - No Profiles Downloaded
60071,FeedService,Feed Server communication issue
60072,FeedService,Profiler Feed Service reported that the Feed is unavailable
60073,FeedService,Querying the Profiler Feed Service resulted in an unexpected error
60074,FeedService,Importing downloaded profiles from the Profiler Feed Service resulted in an unexpected error
60075,Sponsor,Sponsor has successfully authenticated
60076,Sponsor,Sponsor authentication has failed
60077,MyDevices,MyDevices user authentication has failed
60078,MyDevices,MyDevices user has successfully authenticated
60079,Administrator-Login,A failure to establish an SSL session was detected
60080,Administrator-Login,A SSH CLI user has successfully logged in
60081,Administrator-Login,A SSH CLI user has attempted unsuccessfully to login
60082,Administrator-Login,A SSH CLI user has attempted to login
60083,System-Management,Syslog Server configuration change
60084,System-Management,ADEOS CLI user configuration change
60085,System-Management,ADEOS Repository configuration change
60086,System-Management,ADEOS SSH Service configuration change
60087,System-Management,ADEOS Maximum SSH CLI sessions configuration change
60088,System-Management,ADEOS SNMP agent configuration change
60089,System-Management,ADEOS CLI kron scheduler policy configuration change
60090,System-Management,ADEOS CLI kron scheduler occurrence configuration change
60091,System-Management,ADEOS CLI pre-login banner configuration change
60092,System-Management,ADEOS CLI post-login banner configuration change
60093,System-Management,ISE Backup has started
60094,System-Management,ISE Backup has completed successfully
60095,System-Management,ISE Backup has failed
60096,System-Management,ISE Log backup has started
60097,System-Management,ISE Log Backup has completed successfully
60098,System-Management,ISE Log Backup has failed
60099,System-Management,ISE Restore has started
60100,System-Management,ISE Restore has completed successfully
60101,System-Management,ISE Restore has failed
60102,System-Management,Application installation completed successfully
60103,System-Management,Application installation failed
60104,System-Management,Application remove started
60105,System-Management,Application remove completed successfully
60106,System-Management,Application remove failed
60107,System-Management,Application upgrade failed
60108,System-Management,Application patch started
60109,System-Management,Application patch remove has started
60111,System-Management,Application patch remove has completed successfully
60112,System-Management,Application patch remove has failed
60113,Startup-Shutdown,ISE server reload has been initiated
60114,Startup-Shutdown,ISE server shutdown has been initiated
60115,Administrator-Login,A CLI user has logged in from SSH
60116,Administrator-Login,A CLI user has logged out from SSH
60117,System-Management,ADEOS CLI user has been force logged out
60118,System-Management,ADEOS CLI user has used delete CLI to delete file
60119,System-Management,ADEOS CLI user has used copy CLI to copy file
60120,System-Management,ADEOS CLI user has used mkdir CLI to create a directory
60121,System-Management,ADEOS CLI user has copied out running system configuration
60122,System-Management,ADEOS CLI user has copied in system configuration
60123,System-Management,ADEOS CLI user has saved running system configuration
60124,System-Management,ADEOS CLI user failed to login because password has expired
60125,Administrator-Login,A malformed SSH requested has been detected
60126,System-Management,Application patch installation failed
60127,System-Management,Maximum number of concurrent CLI sessions has been reached
60128,System-Management,Failure occurred trying to copy file in from ADEOS CLI
60129,System-Management,Failure occurred trying to copy file out from ADEOS CLI
60130,System-Management,ISE Scheduled Backup has been configured
60131,System-Management,ISE Support bundle has been created from web UI
60132,System-Management,ISE Support bundle has been deleted from web UI
60133,System-Management,ISE Support bundle generation from web UI has failed
60134,System-Management,DNS Resolution failure
60150,Replication,Slow Replication
60151,Replication,Slow Replication
60152,Replication,Slow Replication
60153,System-Management,Certificate has been exported
60154,System-Management,Application patch install has completed successfully
60155,System-Management,Secure communication with syslog server established
60156,System-Management,Secure communication establishment with syslog server failed
60157,System-Management,Unable to copy the exported report file to configured repository
60158,System-Management,All xGrid administrator actions are logged using this message
60159,System-Management,Posture requirements update has started from the remote feed URL
60160,System-Management,Successfully finished updating posture requirements from remote feed URL
60161,System-Management,Failed to update Posture requirements from the remote feed URL
60162,System-Management,Checking for the updated Posture requirements on the remote feed URL
60163,System-Management,Processing the updated Posture requirements received from the remote feed URL
60164,System-Management,NTP Service is down on the node
60165,System-Management,NTP failed to sync with configured servers
60166,Certificate,Certificate will expire soon
60167,Certificate,Certificate has expired
60168,System-Management,Session Repeat Count has reset successfully
60169,System-Management,Session Repeat Count reset has failed
60170,System-Management,Resetting Repeat Count is successful for all sessions
60171,System-Management,Resetting Repeat Count has failed for all sessions
60172,System-Management,Alarm(s) has/have been acknowledged
60173,System-Management,Outdated alarms are purged
60174,CRL,Could not add Certificate Revocation List
60175,CRL,Could not download Certificate Revocation List
60176,System-Management,Posture Update
60177,System-Management,Application upgrade preparation failed
60178,System-Management,Application upgrade preparation successful
60179,System-Management,Application upgrade preparation started
60180,System-Management,Syslog server Identity check failed
60184,Administrator-Login,A console CLI user has successfully logged in
60185,Administrator-Login,A console CLI user has attempted unsuccessfully to login
60186,Administrator-Login,A console CLI user has attempted to login
60187,System-Management,Application upgrade succeeded
60188,Administrator-Login,An attempted SSH connection has failed
60189,System-Management,Terminal Session timeout has been modified
60190,System-Management,xGrid Administrator Action
60191,System-Management,Insufficient Virtual Machine Resources on node
60192,System-Management,Firmware update required on node
60193,System-Management,RSA key configuration has been modified
60194,System-Management,Host key configuration has been modified
60195,CA-Service,CA Service started
60196,CA-Service,CA Service stopped
60197,CA-Service,Revoked ISE CA issued Certificate.
60198,System-Management,MnT purge event occurred
60199,TrustSec,An IP-SGT mapping was deployed successfully
60200,TrustSec,An IP-SGT mapping has failed deploying
60201,TrustSec,IP-SGT deployment to TrustSec device was successful
60202,TrustSec,IP-SGT deployment to TrustSec device failed
60203,TrustSec,IP-SGT deployment to the TrustSec devices finished
60204,System-Management,System root CLI account has successfully logged in
60205,Administrator-Login,A CLI user has logged in from console
60206,Administrator-Login,A CLI user has logged out from console
60207,System-Management,logging loglevel configuration has been modified
60208,System-Management,Root CA certificate has been replaced
60209,System-Management,CA service enabled
60210,System-Management,CA service disabled
60211,System-Management,ISE acquired subordinate certificate authority from 3rd party CA server
60212,System-Management,Portal could not start on this node since Certificate tag is missing
60213,System-Management,CA keys were replaced by import operation
60214,System-Management,CA keys were exported
60215,CA-Service,Endpoint certs were marked expired
60216,CA-Service,Endpoint certs were purged
60217,Replication,Certificate replication failed and will be retried
60218,Replication,Certificate replication failed
60219,Distributed-Management,Administration Node has not received any PAN HA monitoring request from monitoring node
60221,Distributed-Management,Misconfiguration in PAN HA monitoring
60222,Distributed-Management,PAN is not reachable or unhealthy
60223,Distributed-Management,PAN HA Promotion request failed
60224,Distributed-Management,Automatic failover to the Secondary PAN is successfully triggered
60225,Client Provisioning,Unable to build the certificate chain
60226,Certificate,Successfully performed CoA termination(s) for a user certificate being revoked
60227,Certificate,Failed to perform a CoA termination
60228,System-Management,MSE Server is unreachable
60229,System-Management,MSE Server is back online
60231,System-Management,Queried MSE server
60232,System-Management,Started ongoing sessions check against automatically retrieved CRL
60233,Dynamic-Authorization,The endpoint session is terminated due to the revoked certificate
60234,Sxp,The SXP connection has been disconnected
60235,SXP,SXP connection succeeded
60236,SXP,SXP connection failed
60237,SXP,SXP binding is successful
