MESSAGE_CODE,MESSAGE_CLASS,MESSAGE_TEXT
60238,SXP,SXP binding failed
60239,SXP,SXP binding conflict has occurred
60400,Configuration-Changes,Policy elements have been generated based on network device profile configuration.
60401,Configuration-Changes,Reminder: Assign NAD Profiles.
60451,System-Management,Telemetry is enabled on this deployment
60452,System-Management,Telemetry is disabled on this deployment
60453,System-Management,Telemetry messages were sent successfully
60454,System-Management,Telemetry messages were not sent successfully
60455,System-Management,Easy Wired is selected on Allowed Protocol but Identity Mapping has NOT been activated
60456,System-Management,Started CRL/OCSP periodic certificate check
60457,Admin Access Authentication Method,Authentication Type Method for Admin UI Access
60458,Admin Access Authentication Method,Authentication Type Method for Admin UI Access
60459,SXP,SXP binding  not propagated because binding threshold has been reached
60501,ERS,ERS xml input is a suspect for XSS or Injection attack
60502,ERS,ERS identified deprecated url
60503,ERS,ERS identified out-dated url
60504,ERS,ERS request content-type header is out-dated
70010,System-Stats,OCSP Statistics
70011,System-Stats,ISE Counters
80013,Profiler,Profiler EndPoint feed profiling event occurred
80014,Profiler,Profiler EndPoint purge event occurred
80015,Profiler,Profiler queue size limit has been reached.
86028,Guest,Successfully performed CoA termination(s) for a deleted guest or a suspended guest
86029,Guest,Failed to perform a CoA termination
86030,GUEST,Sponsor user accepted the user policy
86031,GUEST,Sponsor user declined the user policy
87600,Supplicant Provisioning,Supplicant provisioning succeeded
87601,Supplicant Provisioning,Supplicant provisioning failed
87602,Supplicant Provisioning,Supplicant provisioning is in progress
87603,Supplicant Provisioning,Supplicant provisioning disabled
87604,Supplicant Provisioning,CA Server is down
87605,Supplicant Provisioning,CA Server is up
87606,Supplicant Provisioning,Certificate request forwarding failed
87607,Supplicant Provisioning,High volume of OCSP transactions
87752,Internal CA,Manual Certificate Provisioning Portal - Request submitted
87753,Internal CA,Manual Certificate Provisioning Portal - Status Update
87754,Internal CA,Manual Certificate Provisioning Portal - User login occurred
88000,MyDevices,Successfully added a device (endpoint)
88001,MyDevices,Failed to added a device (endpoint)
88002,MyDevices,Successfully modified the device (endpoint)
88003,MyDevices,Failed to modify the device (endpoint)
88004,MyDevices,Successfully deleted the device (endpoint)
88005,MyDevices,Failed to delete the device (endpoint)
88006,MyDevices,Successfully blacklisted the device (endpoint)
88007,MyDevices,Failed to deny the device (endpoint)
88008,MyDevices,Successfully reinstated the device (endpoint)
88009,MyDevices,Failed to reinstate the device (endpoint)
88010,MyDevices,Successfully registered/provisioned the device (endpoint)
88011,MyDevices,Failed to register/provision the device (endpoint)
88012,MyDevices,Successfully performed a CoA termination
88013,MyDevices,Failed to perform a CoA termination
88014,MyDevices,Successfully performed a CoA re-authentication
88015,MyDevices,Failed to perform a CoA re-authentication
89000,MDM,Mobile device manager unregistered
89001,MDM,Mobile device management compliant
89002,MDM,Mobile device management non-compliant
89003,MDM,Failed to connect to MDM server
89004,MDM,MDM server API version mismatch
89005,MDM,MDM server response error
89050,MDM,Administrative action submitted
89051,MDM,Administrative action delivered to mobile device
89052,MDM,Administrative action failed
89100,MDM,Mobile device enrollment initiated
89101,MDM,Mobile device enrollment failed
89102,MDM,Mobile device enrolled successfully
89103,MDM,Mobile device deregistered
89104,MDM,Mobile Device Service initialized
89105,MDM,Mobile Device Service initialization failed
89106,MDM,Mobile Device Service stopped
89107,MDM,Unable to send notifications to mobile device
89108,MDM,APNS Certificate is about to expire
89109,MDM,Endpoint certificate is going to expire soon.
89110,MDM,Mobile Device check-in request is not authorized.
89111,MDM,Mobile Device check-in request is authorized.
89112,MDM,Endpoint certificate is renewed.
89113,MDM,Inactive Mobile Device is detected
89114,MDM,GeoLocation coordinates received
89115,MDM,Profile Installed
89116,MDM,Profile Removed
89117,MDM,Application Installed
89118,MDM,Application Removed
89119,MDM,Device reassessment has failed.
89132,MDM,Endpoint certificate is going to expire soon.
89133,MDM,Endpoint certificate has expired.
89142,MDM,Provisioning operation failed.
89143,MDM,Mobile device record is updated with new device information
89144,MDM,Endpoint certificate renewal has failed.
89149,MDM,Mobile device is compliant
89150,MDM,Mobile device is not compliant
89151,MDM,Certificate issued by external CA can be revoked because the mobile device no longer uses it.
89152,MDM,Mobile device unenrollment initiated
89153,MDM,Certificates missing for Notification Systems.
89154,MDM,Apple Volume Purchase Plan (VPP) service token is invalid.
89155,MDM,Failed to access Apple Volume Purchase Plan (VPP) services.
89156,MDM,CMCS server unreachable
89157,MDM,CMCS authentication failure
89158,MDM,APNS server unreachable
89159,MDM,APNS authentication failure
89160,MDM,MDM User Authentication completed
89200,MDM,Invalid payload encountered in in mobile device enrollment request.
89201,MDM,Invalid session encountered in mobile device enrollment request.
89202,MDM,Authentication failure encountered while handling mobile device enrollment request.
89203,MDM,Authorization failure encountered while handling mobile device enrollment request.
89204,MDM,Authorization failure encountered while handling mobile device enrollment request. The user must uninstall the iOS MDM profile before retrying the enrollment.
89205,MDM,Internal Error encountered while handling mobile device enrollment request.
89206,MDM,Mobile device enrollment attempt has expired.
89207,MDM,Unsupported mobile device platform encountered while handling enrollment request.
89208,MDM,Maximum number of authentication attempts has been exceeded.
89209,MDM,Mobile device enrollment request failed due to no matching MDM profile.
89210,MDM,Mobile device enrollment request failed due to unconfigured MDM trust anchor
89211,MDM,Invalid payload encountered in in mobile device check-in request.
89212,MDM,Unsupported mobile device platform encountered while handling check-in request.
89213,MDM,Profile signing failed.
89214,MDM,Profile encryption failed.
89215,MDM,Invalid payload encountered while handling profile provisioning request.
89216,MDM,Authorization failure encountered while handling profile provisioning request.
89217,MDM,Internal Error encountered while handling profile provisioning request.
89218,MDM,Profile signing failed due to misconfiguration of the MDM certificate.
89219,MDM,The application request timed out.
89220,MDM,Internal Error encountered while handling application request.
89221,MDM,The profile request timed out
89222,MDM,Maximum number of token resets exceeded
89223,MDM,Failed to send token
89224,MDM,Token configurations are incomplete
90046,Identity Mapping,Identity Mapping internal error
90047,Identity Mapping,Identity Mapping is now the primary node
90048,Identity Mapping,Identity Mapping is no longer the primary node
90049,Identity Mapping,Identity Mapping primary node was elected
90050,Identity Mapping,Identity Mapping primary node is not responsive
90051,Identity Mapping,Identity mapping service started
90052,Identity Mapping,Keep alive between identity mapping services is unavailable
90053,Identity Mapping,Cannot resolve identity mapping service name
90054,Identity Mapping,Active identity mapping service is set
90055,Identity Mapping,Standby identity mapping service is set
90056,Identity Mapping,Identity mapping service cannot apply configuration
90057,Identity Mapping,Identity mapping service applied configuration
90058,Identity Mapping,Cannot resolve Domain Controller hostname
90059,Identity Mapping,Cannot get Domain Controller Windows version
90060,Identity Mapping,Domain Controller Windows version is unsupported
90061,Identity Mapping,Cannot get Domain Controller NetBIOS
90062,Identity Mapping,Cannot connect to Domain Controller
90063,Identity Mapping,Successfully establish connection to Domain Controller
90064,Identity Mapping,Cannot get history login events
90065,Identity Mapping,Received history login events
90066,Identity Mapping,Lost connection with Domain Controller
90067,Identity Mapping,Received login event
90068,Identity Mapping,Received machine login event
90069,Identity Mapping,Replaced local IP
90070,Identity Mapping,Received incorrect login event
90071,Identity Mapping,Received unsupported login event
90072,Identity Mapping,Filtered login event
90073,Identity Mapping,Login events are being dropped as storage size has been exceeded
90074,Identity Mapping,Forwarded login event to ISE session directory
90075,Identity Mapping,Cannot forward login event to ISE session directory
90076,Identity Mapping,The number of events handled in the last 24 hours
90077,Identity Mapping,The number of events handled in the last hour
90078,Identity Mapping,Closed connection to Domain Controller
90079,Identity Mapping,Identity mapping service shutdown
12968,EAP,Client didn't provide suitable ciphers
13076,Device-administration,No command set for selected rule
13077,Tacacs-Accounting,Invalid TACACS+ accouting request packet - possibly malformed packet
13078,Device-administration,Invalid TACACS+ authorization request packet - possibly malformed packet
24716,External-Active-Directory,Active Directory Kerberos ticket authentication succeeded
24717,External-Active-Directory,Active Directory Kerberos ticket authentication failed
24718,External-Active-Directory,Active Directory Kerberos ticket expired
24719,External-Active-Directory,"Active Directory Kerberos ticket authentication failed because of the ISE account password mismatch, integrity check failure or expired ticket"
25058,AD-Connector,ISE is not joined to an Active Directory Domain Controller
35040,Licensing,Fewer VM licenses installed than VM nodes deployed
35041,Licensing,Fewer Device Admin licenses installed than Device Admin nodes deployed
51116,User change password,Invalid new password. Password must not contain dictionary words or their characters in reverse order
59050,EAP-TLS,Received request to revoke all Tickets
59051,EAP-TLS,Generated new EAP-TLS seed key
59052,EAP-TLS,Successfully updated EAP-TLS seed key
60135,MyDevices,MyDevices user SSO logout has failed
60136,Sponsor,Sponsor user SSO logout has failed
60460,System-Management,Account disabled due to inactivity
60461,System-Management,Account disabled due to user level date expiry
60462,System-Management,Account disabled due to global level date expiry
60463,System-Management,Account disabled due to global level days expiry
60464,System-Management,Smart Call Home messages were sent successfully
60465,System-Management,Smart Call Home messages were not sent successfully
60505,ERS,ERS request rejected due to invalid input.
60506,ERS,ERS request suspicious of malicious attack
60507,ERS,ERS request rejected due to unauthorized user.
60508,ERS,ERS request was rejected due to illegal request on a non-primary node
60509,ERS,ERS request was denied as maximum possible connection was exceeded
61030,TrustSec,TrustSec deploy verification was canceled.
61031,TrustSec,TrustSec deploy verification failed to reach NAD.
61032,TrustSec,TrustSec deploy verification - policy difference.
61033,TrustSec,TrustSec deployment verification process succeeded.
61034,ResourceLimits,Maximum resource limit reached.
61035,TrustSec,IP SGT static mapping has been sent to the NAD.
61001,TrustSec,APIC self signed Certificate was used
61002,TrustSec,ISE has learned a new SGT from IEPG
61003,TrustSec,ISE has propagated a new EEPG to APIC
61004,TrustSec,ISE has learned a new SXP mapping from APIC endpoint
61005,TrustSec,ISE has propagated a new endpoint(SXP mapping) to APIC
61006,TrustSec,ISE has removed an SGT due to deleted IEPG
61007,TrustSec,ISE has removed EEPG from APIC due to SGT deletion
61008,TrustSec,ISE has removed an SXP mapping due to endpoint deletion on APIC
61009,TrustSec,ISE has removed endpoint APIC due to SXP mapping removal a new SXP mapping to APIC
61010,TrustSec,ISE has established connection to APIC
61011,TrustSec,ISE was disconnected from APIC
61012,TrustSec,ISE has authenticated against APIC successfully
61013,TrustSec,ISE failed to authenticate against APIC
61014,TrustSec,ISE has refreshed authentication against APIC successfully
61015,TrustSec,ISE failed to refresh authenticate against APIC
61016,TrustSec,ISE failed to refresh EPG subscriber against APIC
61017,TrustSec,ISE failed to refresh endpoint subscriber against APIC
61018,TrustSec,ISE failed to refresh EEPG subscriber against APIC
61020,TrustSec,ISE failed to refresh L3EXTOUT subscriber against APIC
61021,TrustSec,"After 3 retries, ISE recieved EPG with class id: ANY. Ignoring this EPG"
61022,TrustSec,ISE has failed to propagate SGT to EEPG
61023,TrustSec,ISE has failed to learn IEPG from APIC
61024,TrustSec,ISE has failed to parse VRF for EPG
61025,System-Management,Open secure connection with TLS peer
61026,System-Management,Shutdown secure connection with TLS peer
61027,Bad-HTTP-Request,Received Invalid or Bad HTTP request
61028,TrustSec,TrustSec deploy verification has started.
61029,TrustSec,TrustSec deploy verification has finished.
61076,Sponsor,Sponsor has been successfully logged out
61051,SynfloodLimitConfigured,Synflood-limit configured
61052,RateLimitConfigured,rate-limit configured
61053,UserInputControl,"Invalid user input detected. * \ $ @ characters are not allowed"
61054,Configuration-Changes,ISE found Invalid authorization profile
61055,System-Management,The memory consumed by the queue is high
61056,System-Management,The federation link was down
61057,System-Management,The space available to the queue is low
61058,TrustSec,ISE has failed to update the APIC server with SGT/SGT-IP mappings
61059,Administrative and Operational Audit,Request from Customer Success Network
22074,Authentication,This Protocol is disabled in FIPS mode.
22080,Authentication,New accounting session created in Session cache
22081,Authentication,Max sessions policy passed
22082,Authentication,Max sessions policy disabled
22083,Authentication,User/group session counters incremented on accounting start
22084,Authentication,User/group session counters decremented on accounting stop
22085,Authentication,The accounting session was updated in Session cache
22086,Authentication,The active sessions were purged for device
22087,Authentication,The accounting session was timed out
22088,Authentication,The accounting session was purged
22089,Authentication,New user session not permitted. Max sessions user limit has been reached
22090,Authentication,One or more attributes are missing for the accounting Session Key
22091,Authentication,Authentication failed. User account is disabled due to excessive failed authentication attempts at global level
22092,Authentication,No accounting start was received for the session
22093,Authentication,Duplicate session was found with a different user name
22094,Authentication,Audit session was not found
22095,Authentication,Accounting start was received for non-existing session
22096,Authentication,Max session policy is not available for Proxy
22097,Authentication,New user session not permitted. Max sessions group limit has been reached
22098,Authentication,New user session not permitted. Max sessions user in group limit has been reached
5449,RADIUS,Endpoint failed authentication of the same scenario several times and was rejected
5450,Failed-Attempt,RADIUS DTLS handshake failed
5451,GUEST,Social Login: User did not grant permission for ISE application to read user's information from Facebook
5452,GUEST,Social Login: Error while getting Social User info
24054,External-LDAP,User authentication against LDAP server detected that user password has expired
24055,External-LDAP,User authentication against LDAP server detected that the user is authenticating for the first time after the password administrator set the password
24056,External-LDAP,User authentication against LDAP server detected that user password has expired and there are no more grace authentications
24057,External-LDAP,User authentication against LDAP server detected that the password failure limit has been reached and the account is locked
24058,External-LDAP,LDAP server does not support password modify extended operation (RFC 3062)
24059,External-LDAP,User password change ended with an error
24060,External-LDAP,Changing user's password on LDAP Server
24061,External-LDAP,Sent password modify request
24062,External-LDAP,Received password modify response
24063,External-LDAP,The user's password will expire soon
24064,External-LDAP,The user doesn't have sufficient rights to change password
24065,External-LDAP,The new password does not conform to LDAP password policy
24066,External-LDAP,User password change succeeded
24067,External-LDAP,The password change is not enabled on LDAP Identity Store configuration page
24324,External-Active-Directory,Identity resolution detected multiple matching accounts
24560,External-RSA-SecurID-Server,Searching for user record in RSA identity store Passcode cache
24561,External-RSA-SecurID-Server,User record was found in Passcode cache
24562,External-RSA-SecurID-Server,User record was not found in Passcode cache
24563,External-RSA-SecurID-Server,An error occurred while searching for user record in the Passcode cache
24564,External-RSA-SecurID-Server,Passcode cache is not enabled in the RSA identity store configuration
24565,External-RSA-SecurID-Server,Authentication passed via Passcode cache
24566,External-RSA-SecurID-Server,Cached Passcode doesn't match passcode in authentication request. Passcode will be removed from the cache
24567,External-RSA-SecurID-Server,User record was cached in Passcode cache
24568,External-RSA-SecurID-Server,User record was not cached in Passcode cache
24634,Radius-Token,Searching for user record in RADIUS token identity store Passcode cache
24635,Radius-Token,User record was found in Passcode cache
24636,Radius-Token,User record was not found in Passcode cache
24637,Radius-Token,An error occurred while searching for user record in the Passcode cache
24638,Radius-Token,Passcode cache is not enabled in the RADIUS token identity store configuration
24639,Radius-Token,Authentication passed via Passcode cache
24640,Radius-Token,Cached Passcode doesn't match passcode in authentication request. Passcode will be removed from the cache
24641,Radius-Token,User record was cached in Passcode cache
24642,Radius-Token,User record was not cached in Passcode cache
24713,External-Active-Directory,ISE peer has confirmed previous successful machine authentication for user in Active Directory
24714,External-Active-Directory,ISE peers have not confirmed previous successful machine authentication for user in Active Directory
24715,External-Active-Directory,ISE has not confirmed locally previous successful machine authentication for user in Active Directory
24849,External-ODBC,Connecting to external ODBC database
34159,System-Management,LDAPS connection established successfully
34160,System-Management,LDAPS connection terminated successfully
34161,System-Management,LDAPS connection establishment failed with SSL error
34162,System-Management,LDAPS connection terminated with SSL error
34163,System-Management,LDAPS connection establishment failed with non-SSL error
34164,System-Management,LDAPS connection terminated with non-SSL error
35000,Licensing,Smart Licensing registration failed
35001,Licensing,Smart Licensing disabled
35002,Licensing,Smart Licensing communication failure
35003,Licensing,Smart Licensing communication restored
35004,Licensing,Smart Licensing Id Certificate renew failure
35005,Licensing,Smart Licensing Id Certificate renew success
35006,Licensing,Smart Licensing Agent is Out Of Compliance
35007,Licensing,Smart Licensing evaluation period expired
35008,Licensing,Smart Licensing authorization expired
35009,Licensing,Invalid Smart Licensing request issued
35010,Licensing,License is set to expire soon
35011,Licensing,License expired
35012,Licensing,Device count exceeded for base license
35013,Licensing,License deletion failed
35014,Licensing,License create failed
35015,Licensing,License update failed
35016,Licensing,Smart Licensing registration success
35017,Licensing,Smart Licensing authorization renewal success
35018,Licensing,Smart Licensing authorization renewal failure
35019,Licensing,Smart Licensing de-registration success
35020,Licensing,Smart Licensing de-registration failure
35021,Licensing,Smart Licensing id certificate expired
35022,Licensing,Smart Licensing HA Role changed
35023,Licensing,License expiring within 90 Days
35024,Licensing,License expiring within 60 Days
35025,Licensing,License expiring within 30 Days
35026,Licensing,License Out of Compliance for 5 or more days
35027,Licensing,License Out of Compliance for 15 or more days
35028,Licensing,License Out of Compliance for 30 or more days
35029,Licensing,License Out of Compliance for more than 45 Days Services Configuration Disabled
35030,Licensing,License exceeded 100% session usage
35031,Licensing,License exceeded 125% session usage
35032,Licensing,License expiring Within 90 Days
35033,Licensing,License expiring Within 60 Days
35034,Licensing,License expiring Within 30 Days
35035,Licensing,License expired
35036,Licensing,License expiring Within 90 Days
35037,Licensing,License expiring Within 60 Days
35038,Licensing,License expiring Within 30 Days
35039,Licensing,License expired
5240,RADIUS,Previously rejected endpoint was released to continue authentications
5241,Passed-Authentication,RADIUS DTLS handshake succeeded
90080,PassiveID,PassiveID service collected details
90081,PassiveID,Failed to start REST server
90082,PassiveID,Failed to open syslog port
90083,PassiveID,Forwarded logout event to session directory
90084,PassiveID,Endpoint Probe Service is Starting
90085,PassiveID,Endpoint Probe Service Stoped
90086,PassiveID,Endpoint Probe unexpected service termination
90088,PassiveID,Endpoint Probe configuration update domain admin list
90089,PassiveID,Endpoint Probe configuration update domain information
90090,PassiveID,Endpoint Probe configuration deleted a domain admin
90091,PassiveID,Endpoint Probe service status changed to disabled
90092,PassiveID,Endpoint Probe service status changed to enabled
90093,PassiveID,Endpoint Probe service status changed result with ERROR !
90094,PassiveID,Endpoint Probe service status changed result with ERROR !
90095,PassiveID,Endpoint Probe service status changed to enabled !
90096,PassiveID,Endpoint Probe service status changed to disabled !
90097,PassiveID,Endpoint Probe configuration apply new configuration result with error
90098,PassiveID,Endpoint Probe delete configuration result with error
90099,PassiveID,Endpoint Probe update configuration result with error
90100,PassiveID,Endpoint Probe Manual Check completed with error
90101,PassiveID,Endpoint Probe Manual Check starting
90102,PassiveID,Endpoint Probe Scheduler starting
90103,PassiveID,Endpoint Probe complete fetching endpoint list to verify current login identity
90104,PassiveID,Endpoint Probe monitor check completed successfully.
90105,PassiveID,Endpoint Probe monitor check completed with ERROR
90106,PassiveID,Endpoint Probe Scheduler Manager Starting
90107,PassiveID,Endpoint Probe Scheduler Manager canceled
90108,PassiveID,Endpoint Probe enabling WMI on Endpoint
90109,PassiveID,Endpoint Probe failed to enable WMI on Endpoint
90110,PassiveID,Endpoint Probe enabling WMI on Endpoint
90111,PassiveID,Endpoint domain admin credentials are not known for provided DOMAIN
90112,PassiveID,Endpoint probe check result with user is still active
90113,PassiveID,Endpoint probe check result with user is still active
90114,PassiveID,Endpoint probe check result with unreachable endpoint
90115,PassiveID,Endpoint Probe : DNS reverse lookup failed .
90116,PassiveID,Endpoint Probe configuration list of endpoint network subnet to monitor
90117,PassiveID,Endpoint Probe Total number of session need valid login user
90118,PassiveID,Fatal error occourd during SYSLOG probe startup
90119,PassiveID,Start listening to tcp port
90120,PassiveID,Start listening to udp port
90121,PassiveID,Applied template for hostname
90122,PassiveID,"DNS resoultion failed for syslog client, Will not parse messages from this client"
90123,PassiveID,"Receive message from unkown client, Droping message"
90124,PassiveID,Receive unkown syslog format message
90125,PassiveID,Couldn't find session ID in ISE/ACS syslog message
90126,PassiveID,Couldn't find IP address in ISE/ACS syslog message
90127,PassiveID,"Receive ISE/ACS start/update radius message without pass authentication, Can't create PassiveID session"
90128,PassiveID,Failed to apply configuration
90129,PassiveID,Error
90130,PassiveID,Error
90131,PassiveID,Error
90132,PassiveID,Could not parse Syslog message
90133,PassiveID,Invalid Syslog message format
90134,PassiveID,Could not parse Syslog hostname from message
90135,PassiveID,Message received
90136,PassiveID,Syslog protocol server error
90137,PassiveID,Syslog listener is up
90138,PassiveID,Syslog listener is down
90139,PassiveID,"Identity Mapping message received, dropped"
90140,PassiveID,Message parsed
90141,PassiveID,Incomplete message received
90142,PassiveID,No Active Directory with credentials were found. Endpoint check will not run
90143,PassiveID,This IP is not part of any configured subnet. Endpoint check will not run
